{"approval_seq":42,"baseline_sha256":"sha256:a425d236cf58e785cd12fcbe603ef1b8721ba315b48c04367d8a5334de4cf5cc","briefing_sha256":"sha256:f7f7f7f7f7f7f7f7f7f7f7f7f7f7f7f7f7f7f7f7f7f7f7f7f7f7f7f7f7f7f7f7","ceremony_class":"ordinary","host":"ed25519:a1a1a1a1a1a1a1a1a1a1a1a1a1a1a1a1a1a1a1a1a1a1a1a1a1a1a1a1a1a1a1a1","nonce":"f6f6f6f6f6f6f6f6f6f6f6f6f6f6f6f6","proposed_sha256":"sha256:ad0cb7c024dce9e6f80b388d47f7893bcc1f69c0ccd9ede36aeca095eae19867","schema_version":1,"signature":"ed25519-sig:b8b8b8b8b8b8b8b8b8b8b8b8b8b8b8b8b8b8b8b8b8b8b8b8b8b8b8b8b8b8b8b8b8b8b8b8b8b8b8b8b8b8b8b8b8b8b8b8b8b8b8b8b8b8b8b8b8b8b8b8b8b8b8b8","verdict":"accept"}